{
  "$schema": "../../../../../schemas/recipe.schema.json",
  "name": "Pacific Theatre",
  "preparation": "shaken",
  "served_on": "up",
  "glassware": "nick & nora",
  "ingredients": [
    {
      "name": "Absinthe",
      "type": "category",
      "quantity": {
        "amount": 1,
        "unit": "dash"
      }
    },
    {
      "name": "Lime juice",
      "type": "juice",
      "quantity": {
        "amount": 0.5,
        "unit": "oz"
      }
    },
    {
      "name": "Pineapple juice",
      "type": "juice",
      "quantity": {
        "amount": 0.5,
        "unit": "oz"
      }
    },
    {
      "name": "Passion fruit syrup",
      "type": "category",
      "quantity": {
        "amount": 0.5,
        "unit": "oz"
      }
    },
    {
      "name": "Pandan Syrup",
      "type": "syrup",
      "quantity": {
        "amount": 0.5,
        "unit": "oz"
      }
    },
    {
      "name": "Hampden Estate Rum Fire",
      "type": "spirit",
      "quantity": {
        "amount": 0.5,
        "unit": "oz"
      }
    },
    {
      "name": "The Real McCoy 3 Year",
      "type": "spirit",
      "quantity": {
        "amount": 1,
        "unit": "oz"
      }
    }
  ],
  "instructions": [
    "Build ingredients in shaker.",
    "Shake with ice, strain into a chilled Nick & Nora or coupe glass.",
    "Spritz with absinthe.",
    "Garnish with an orchid."
  ],
  "attributions": [
    {
      "relation": "recipe author",
      "source": "Brian Maxwell"
    }
  ],
  "refs": [
    {
      "type": "book",
      "title": "Minimalist Tiki",
      "page": 144
    },
    {
      "type": "youtube",
      "videoId": "B1TlKVreYlM",
      "channel": "mixing-up-tiki"
    }
  ]
}
