{
  "$schema": "../../../../schemas/recipe.schema.json",
  "name": "Pink Squirrel",
  "preparation": "shaken",
  "served_on": "up",
  "glassware": "coupe",
  "ingredients": [
    {
      "name": "Sweet cream",
      "type": "other",
      "quantity": {
        "amount": 1,
        "unit": "oz"
      }
    },
    {
      "name": "Crème de Cacao",
      "type": "category",
      "quantity": {
        "amount": 1,
        "unit": "oz"
      }
    },
    {
      "name": "Tempus Fugit Crème de Noyaux",
      "type": "liqueur",
      "quantity": {
        "amount": 1,
        "unit": "oz"
      }
    }
  ],
  "attributions": [
    {
      "relation": "bar",
      "source": "Bryant's Cocktail Lounge",
      "location": "Milwaukee"
    }
  ],
  "refs": [
    {
      "type": "youtube",
      "videoId": "tazH988uMO4",
      "channel": "educated-barfly"
    }
  ]
}
