{
  "$schema": "../../../../../schemas/recipe.schema.json",
  "name": "Negroni Standing Room",
  "preparation": "stirred",
  "served_on": "big rock",
  "glassware": "old fashioned",
  "ingredients": [
    {
      "name": "cucumber juice",
      "type": "juice",
      "quantity": {
        "amount": 0.25,
        "unit": "oz"
      }
    },
    {
      "name": "Rhine Hall Mango Brandy",
      "type": "spirit",
      "quantity": {
        "amount": 0.5,
        "unit": "oz"
      }
    },
    {
      "name": "Cimarron Blanco Tequila",
      "type": "spirit",
      "quantity": {
        "amount": 1,
        "unit": "oz"
      }
    },
    {
      "name": "Aperol",
      "type": "liqueur",
      "quantity": {
        "amount": 1,
        "unit": "oz"
      }
    },
    {
      "name": "Dolin Blanc Vermouth de Chambéry",
      "type": "wine",
      "quantity": {
        "amount": 1,
        "unit": "oz"
      }
    }
  ],
  "instructions": [
    "Stir all the ingredients over ice, then strain into a double old-fashioned glass over 1 large ice cube. Garnish with the coriander flower."
  ],
  "attributions": [
    {
      "relation": "recipe author",
      "source": "Tyson Buhler"
    },
    {
      "relation": "bar",
      "source": "Death & Co",
      "location": "New York, NY"
    }
  ],
  "refs": [
    {
      "type": "book",
      "title": "death-co-welcome-home",
      "page": 259
    }
  ]
}
