{
  "$schema": "../../../../schemas/recipe.schema.json",
  "name": "Kingston Zing",
  "preparation": "shaken",
  "served_on": "ice cubes",
  "glassware": "highball",
  "ingredients": [
    {
      "name": "Saline",
      "type": "other",
      "quantity": {
        "amount": 5,
        "unit": "drop"
      }
    },
    {
      "name": "Bittermens Hopped Grapefruit Bitters",
      "type": "bitter",
      "quantity": {
        "amount": 6,
        "unit": "drop"
      }
    },
    {
      "name": "Lime juice",
      "type": "juice",
      "quantity": {
        "amount": 0.375,
        "unit": "oz"
      }
    },
    {
      "name": "Grapefruit punch syrup",
      "type": "syrup",
      "quantity": {
        "amount": 0.5,
        "unit": "oz"
      }
    },
    {
      "name": "Wray & Nephew white overproof",
      "type": "spirit",
      "quantity": {
        "amount": 1.5,
        "unit": "oz"
      }
    },
    {
      "name": "Seltzer",
      "type": "soda",
      "quantity": {
        "amount": 2,
        "unit": "oz"
      }
    }
  ],
  "refs": [
    {
      "type": "book",
      "title": "tropical-standard",
      "page": 87
    }
  ]
}
