{
  "$schema": "../../../../schemas/recipe.schema.json",
  "name": "Pagan Breakfast",
  "preparation": "shaken",
  "served_on": "up",
  "glassware": "nick & nora",
  "ingredients": [
    {
      "name": "Absinthe",
      "type": "category",
      "quantity": {
        "amount": 2,
        "unit": "dash"
      }
    },
    {
      "name": "Simple syrup",
      "type": "syrup",
      "quantity": {
        "amount": 0.5,
        "unit": "oz"
      }
    },
    {
      "name": "Lime juice",
      "type": "juice",
      "quantity": {
        "amount": 0.75,
        "unit": "oz"
      }
    },
    {
      "name": "The Real McCoy 3 Year",
      "type": "spirit",
      "quantity": {
        "amount": 2,
        "unit": "oz"
      }
    }
  ],
  "instructions": [
    "Build ingredients in shaker.",
    "Shake well with cubed ice, strain into a chilled Nick & Nora or coupe glass."
  ],
  "attributions": [
    {
      "relation": "bar",
      "source": "Pagan Idol",
      "location": "San Francisco, CA"
    }
  ],
  "refs": [
    {
      "type": "book",
      "title": "Minimalist Tiki",
      "page": 248
    }
  ]
}
