{
  "$schema": "../../../../../schemas/recipe.schema.json",
  "name": "The Manticore",
  "preparation": "stirred",
  "served_on": "big rock",
  "glassware": "old fashioned",
  "ingredients": [
    {
      "name": "Peychaud's bitters",
      "type": "bitter",
      "quantity": {
        "amount": 1.5,
        "unit": "dash"
      }
    },
    {
      "name": "Cinnamon syrup",
      "type": "syrup",
      "quantity": {
        "amount": 1,
        "unit": "tsp"
      }
    },
    {
      "name": "Giffard Menthe-Pastille",
      "type": "liqueur",
      "quantity": {
        "amount": 1,
        "unit": "tsp"
      }
    },
    {
      "name": "John D. Taylor's Velvet Falernum",
      "type": "liqueur",
      "quantity": {
        "amount": 0.25,
        "unit": "oz"
      }
    },
    {
      "name": "Beefeater London Dry Gin",
      "type": "spirit",
      "quantity": {
        "amount": 2,
        "unit": "oz"
      }
    }
  ],
  "instructions": ["Express the lemon twist over the drink, then place it in the drink."],
  "attributions": [
    {
      "relation": "recipe author",
      "source": "Scott Teague"
    },
    {
      "relation": "bar",
      "source": "Death & Co",
      "location": "New York, NY"
    }
  ],
  "refs": [
    {
      "type": "book",
      "title": "death-co-welcome-home",
      "page": 237
    }
  ]
}
