{
  "$schema": "../../../../schemas/recipe.schema.json",
  "name": "Jump Up, Jamaica",
  "preparation": "shaken",
  "served_on": "ice cubes",
  "glassware": "wine glass",
  "ingredients": [
    {
      "name": "Saline",
      "type": "other",
      "quantity": {
        "amount": 5,
        "unit": "drop"
      }
    },
    {
      "name": "Angostura bitters",
      "type": "bitter",
      "quantity": {
        "amount": 2,
        "unit": "dash"
      }
    },
    {
      "name": "Lime juice",
      "type": "juice",
      "quantity": {
        "amount": 0.5,
        "unit": "oz"
      }
    },
    {
      "name": "Grapefruit punch syrup",
      "type": "syrup",
      "quantity": {
        "amount": 1.5,
        "unit": "oz"
      }
    },
    {
      "name": "Wray & Nephew white overproof",
      "type": "spirit",
      "technique": {
        "technique": "infusion",
        "agent": "serrano pepper"
      },
      "quantity": {
        "amount": 0.5,
        "unit": "oz"
      }
    },
    {
      "name": "Coruba",
      "type": "spirit",
      "quantity": {
        "amount": 0.5,
        "unit": "oz"
      }
    },
    {
      "name": "Rum",
      "type": "category",
      "technique": {
        "technique": "infusion",
        "agent": "sorrel"
      },
      "quantity": {
        "amount": 1,
        "unit": "oz"
      }
    },
    {
      "name": "Seltzer",
      "type": "soda",
      "quantity": {
        "amount": 3,
        "unit": "oz"
      }
    }
  ],
  "attributions": [
    {
      "relation": "recipe author",
      "source": "Garret Richard"
    },
    {
      "relation": "bar",
      "source": "Sunken Harbor Club",
      "location": "Brooklyn, NY"
    }
  ],
  "refs": [
    {
      "type": "book",
      "title": "tropical-standard",
      "page": 167
    }
  ]
}
