{
  "$schema": "../../../../schemas/recipe.schema.json",
  "name": "Navy Mai Tai",
  "preparation": "shaken",
  "served_on": "crushed ice",
  "glassware": "old fashioned",
  "ingredients": [
    {
      "name": "Honey syrup",
      "type": "syrup",
      "quantity": {
        "amount": 0.5,
        "unit": "oz"
      }
    },
    {
      "name": "Orgeat",
      "type": "category",
      "quantity": {
        "amount": 0.5,
        "unit": "oz"
      }
    },
    {
      "name": "Grapefruit juice",
      "type": "juice",
      "quantity": {
        "amount": 0.5,
        "unit": "oz"
      }
    },
    {
      "name": "Lime juice",
      "type": "juice",
      "quantity": {
        "amount": 0.5,
        "unit": "oz"
      }
    },
    {
      "name": "Pierre Ferrand Dry Curaçao",
      "type": "liqueur",
      "quantity": {
        "amount": 0.5,
        "unit": "oz"
      }
    },
    {
      "name": "El Dorado 12 Year",
      "type": "spirit",
      "quantity": {
        "amount": 0.5,
        "unit": "oz"
      }
    },
    {
      "name": "Wray & Nephew white overproof",
      "type": "spirit",
      "quantity": {
        "amount": 0.5,
        "unit": "oz"
      }
    },
    {
      "name": "Smith & Cross",
      "type": "spirit",
      "quantity": {
        "amount": 1,
        "unit": "oz"
      }
    }
  ],
  "instructions": [
    "Combine all the ingredients in a shaker with ice.",
    "Shake and strain into an old fashioned glass with crushed ice.",
    "Garnish with a mint sprig."
  ],
  "refs": [
    {
      "type": "youtube",
      "videoId": "bvi9XE6IA6Y",
      "channel": "mixing-up-tiki"
    }
  ]
}
