{
  "$schema": "../../../../schemas/recipe.schema.json",
  "name": "Espresso Martini",
  "preparation": "shaken",
  "served_on": "up",
  "glassware": "coupe",
  "ingredients": [
    {
      "name": "lemon",
      "type": "fruit",
      "technique": {
        "technique": "cut",
        "type": "peeled"
      },
      "quantity": {
        "amount": 1,
        "unit": "unit"
      }
    },
    {
      "name": "Demerara syrup",
      "type": "syrup",
      "brix": 66,
      "quantity": {
        "amount": 0.25,
        "unit": "oz"
      }
    },
    {
      "name": "espresso",
      "type": "other",
      "quantity": {
        "amount": 1,
        "unit": "oz"
      }
    },
    {
      "name": "Mr. Black coffee liqueur",
      "type": "liqueur",
      "quantity": {
        "amount": 1,
        "unit": "oz"
      }
    },
    {
      "name": "Vodka",
      "type": "category",
      "quantity": {
        "amount": 1,
        "unit": "oz"
      }
    }
  ],
  "instructions": [
    "Express lemon oil into a shaker.",
    "Add remaining ingredients and ice.",
    "Shake hard for 10 to 15 seconds.",
    "Double strain into a coupe.",
    "Garnish with expressed lemon oil and three coffee beans."
  ],
  "attributions": [
    {
      "relation": "recipe author",
      "source": "Dick Bradsell"
    },
    {
      "relation": "adapted by",
      "source": "Anders Erickson"
    }
  ],
  "refs": [
    {
      "type": "youtube",
      "videoId": "q0ebbWwoI10",
      "channel": "anders-erickson",
      "start": 235
    }
  ]
}
