{
  "$schema": "../../../../schemas/recipe.schema.json",
  "name": "Penang Afrididi #1",
  "preparation": "flash blended",
  "served_on": "crushed ice",
  "glassware": "snifter",
  "ingredients": [
    {
      "name": "Pernod",
      "type": "spirit",
      "quantity": {
        "amount": 6,
        "unit": "drop"
      }
    },
    {
      "name": "Lime juice",
      "type": "juice",
      "quantity": {
        "amount": 0.25,
        "unit": "oz"
      }
    },
    {
      "name": "Pineapple juice",
      "type": "juice",
      "quantity": {
        "amount": 0.5,
        "unit": "oz"
      }
    },
    {
      "name": "Orange juice",
      "type": "juice",
      "quantity": {
        "amount": 0.5,
        "unit": "oz"
      }
    },
    {
      "name": "Passion fruit syrup",
      "type": "category",
      "quantity": {
        "amount": 0.5,
        "unit": "oz"
      }
    },
    {
      "name": "Column still lightly aged rum",
      "type": "category",
      "quantity": {
        "amount": 1.5,
        "unit": "oz"
      }
    },
    {
      "name": "Column still aged rum",
      "type": "category",
      "quantity": {
        "amount": 1.5,
        "unit": "oz"
      }
    }
  ],
  "refs": [
    {
      "type": "youtube",
      "videoId": "aQq0eLv4Emo",
      "channel": "make-and-drink"
    }
  ]
}
