{
  "$schema": "../../../../../schemas/recipe.schema.json",
  "name": "Monarch Julep",
  "preparation": "built",
  "served_on": "crushed ice",
  "glassware": "julep",
  "ingredients": [
    {
      "name": "Honey syrup",
      "type": "syrup",
      "quantity": {
        "amount": 0.25,
        "unit": "oz"
      }
    },
    {
      "name": "CioCiaro",
      "type": "liqueur",
      "quantity": {
        "amount": 0.25,
        "unit": "oz"
      }
    },
    {
      "name": "G.E. Massenez Crème de Pêche",
      "type": "liqueur",
      "quantity": {
        "amount": 0.25,
        "unit": "oz"
      }
    },
    {
      "name": "Peach Street Peach Brandy",
      "type": "spirit",
      "quantity": {
        "amount": 0.5,
        "unit": "oz"
      }
    },
    {
      "name": "Hidalgo Gobernador Oloroso",
      "type": "wine",
      "quantity": {
        "amount": 0.5,
        "unit": "oz"
      }
    },
    {
      "name": "J. Rieger Kansas City Whiskey",
      "type": "spirit",
      "quantity": {
        "amount": 1.5,
        "unit": "oz"
      }
    }
  ],
  "instructions": ["Garnish with a mint bouquet and peach slice. Serve with a straw."],
  "attributions": [
    {
      "relation": "recipe author",
      "source": "Tyson Buhler"
    },
    {
      "relation": "bar",
      "source": "Death & Co",
      "location": "New York, NY"
    }
  ],
  "refs": [
    {
      "type": "book",
      "title": "death-co-welcome-home",
      "page": 237
    }
  ]
}
