{
  "$schema": "../../../../schemas/recipe.schema.json",
  "name": "Arrack punch",
  "preparation": "flash blended",
  "served_on": "crushed ice",
  "glassware": "punch",
  "ingredients": [
    {
      "name": "Lemon juice",
      "type": "juice",
      "quantity": {
        "amount": 2,
        "unit": "oz"
      }
    },
    {
      "name": "Lime juice",
      "type": "juice",
      "quantity": {
        "amount": 2,
        "unit": "oz"
      }
    },
    {
      "name": "Demerara syrup",
      "brix": 66,
      "type": "syrup",
      "quantity": {
        "amount": 3,
        "unit": "oz"
      }
    },
    {
      "name": "Batavia Arrack van Oosten",
      "type": "spirit",
      "quantity": {
        "amount": 6,
        "unit": "oz"
      }
    },
    {
      "name": "Pot still lightly aged overproof rum",
      "type": "category",
      "quantity": {
        "amount": 2,
        "unit": "oz"
      }
    },
    {
      "name": "Carbonated Chai Tea",
      "type": "soda",
      "quantity": {
        "amount": 6,
        "unit": "oz"
      }
    }
  ],
  "refs": [
    {
      "type": "book",
      "page": 163,
      "title": "smugglers-cove"
    }
  ]
}
