{
  "$schema": "../../../../schemas/recipe.schema.json",
  "name": "Magpie",
  "preparation": "shaken",
  "served_on": "crushed ice",
  "glassware": "collins",
  "ingredients": [
    {
      "name": "Papaya Syrup",
      "type": "syrup",
      "quantity": {
        "amount": 0.5,
        "unit": "oz"
      }
    },
    {
      "name": "Lime juice",
      "type": "juice",
      "quantity": {
        "amount": 0.75,
        "unit": "oz"
      }
    },
    {
      "name": "carrot juice",
      "type": "juice",
      "quantity": {
        "amount": 1,
        "unit": "oz"
      }
    },
    {
      "name": "Campari",
      "type": "liqueur",
      "quantity": {
        "amount": 0.75,
        "unit": "oz"
      }
    },
    {
      "name": "Yaguara Cacha√ßa Branca",
      "type": "spirit",
      "quantity": {
        "amount": 2,
        "unit": "oz"
      }
    }
  ],
  "instructions": [
    "Combine all ingredients in a shaker with cubed ice.",
    "Shake and strain into a chilled collins glass over pebbled ice.",
    "Garnish with edible flowers and a scored lime wedge."
  ],
  "refs": [
    {
      "type": "book",
      "title": "Easy Tiki",
      "page": 67
    }
  ]
}
