{
  "$schema": "../../../../schemas/recipe.schema.json",
  "name": "Tree dots and a dash",
  "preparation": "flash blended",
  "served_on": "crushed ice",
  "glassware": "footed pilsner",
  "ingredients": [
    {
      "name": "Lime juice",
      "type": "juice",
      "quantity": {
        "amount": 0.5,
        "unit": "oz"
      }
    },
    {
      "name": "Orange juice",
      "type": "juice",
      "quantity": {
        "amount": 0.5,
        "unit": "oz"
      }
    },
    {
      "name": "Honey syrup",
      "brix": 50,
      "type": "syrup",
      "quantity": {
        "amount": 0.5,
        "unit": "oz"
      }
    },
    {
      "name": "John D. Taylor's Velvet Falernum",
      "type": "liqueur",
      "quantity": {
        "amount": 0.25,
        "unit": "oz"
      }
    },
    {
      "name": "St-Elizabeth Allspice Dram",
      "type": "liqueur",
      "quantity": {
        "amount": 0.25,
        "unit": "oz"
      }
    },
    {
      "name": "Rhum agricole vieux",
      "type": "category",
      "quantity": {
        "amount": 1.5,
        "unit": "oz"
      }
    },
    {
      "name": "Blended aged rum",
      "type": "category",
      "quantity": {
        "amount": 0.5,
        "unit": "oz"
      }
    },
    {
      "name": "Angostura bitters",
      "type": "bitter",
      "quantity": {
        "amount": 1,
        "unit": "dash"
      }
    }
  ],
  "refs": [
    {
      "type": "book",
      "page": 43,
      "title": "smugglers-cove"
    }
  ]
}
