{
  "$schema": "../../../../../schemas/recipe.schema.json",
  "name": "Noble One",
  "preparation": "stirred",
  "served_on": "up",
  "glassware": "old fashioned",
  "ingredients": [
    {
      "name": "House Orange Bitters",
      "type": "bitter",
      "quantity": {
        "amount": 1,
        "unit": "dash"
      }
    },
    {
      "name": "Honey syrup",
      "type": "syrup",
      "quantity": {
        "amount": 0.5,
        "unit": "tsp"
      }
    },
    {
      "name": "Rothman & Winter Orchard Apricot",
      "type": "liqueur",
      "quantity": {
        "amount": 1,
        "unit": "tsp"
      }
    },
    {
      "name": "Quinta do Infantado White Porto",
      "type": "wine",
      "quantity": {
        "amount": 1.5,
        "unit": "oz"
      }
    },
    {
      "name": "Alvear Festival Pale Cream",
      "type": "wine",
      "quantity": {
        "amount": 1.5,
        "unit": "oz"
      }
    }
  ],
  "instructions": ["Express the lemon twist over the drink and discard."],
  "attributions": [
    {
      "relation": "recipe author",
      "source": "Javel Taft"
    },
    {
      "relation": "bar",
      "source": "Death & Co",
      "location": "New York, NY"
    }
  ],
  "refs": [
    {
      "type": "book",
      "title": "death-co-welcome-home",
      "page": 239
    }
  ]
}
