{
  "$schema": "../../../../schemas/recipe.schema.json",
  "name": "Jack Rose",
  "preparation": "shaken",
  "served_on": "up",
  "glassware": "coupe",
  "ingredients": [
    {
      "name": "Grenadine",
      "type": "syrup",
      "quantity": {
        "amount": 0.75,
        "unit": "oz"
      }
    },
    {
      "name": "Lemon juice",
      "type": "juice",
      "quantity": {
        "amount": 0.75,
        "unit": "oz"
      }
    },
    {
      "name": "Laird's Bonded Apple Brandy",
      "type": "spirit",
      "quantity": {
        "amount": 1.5,
        "unit": "oz"
      }
    }
  ],
  "instructions": [
    "Add all ingredients to a shaker with ice.",
    "Shake until well chilled.",
    "Strain into a coupe glass."
  ],
  "refs": [
    {
      "type": "youtube",
      "videoId": "7H7Cz53jDhc",
      "channel": "anders-erickson",
      "start": 249
    },
    {
      "type": "youtube",
      "videoId": "i2auQauQtDw",
      "channel": "make-and-drink",
      "start": 238
    }
  ]
}
