{
  "$schema": "../../../../../schemas/recipe.schema.json",
  "name": "Fog cutter",
  "preparation": "flash blended",
  "served_on": "crushed ice",
  "glassware": "collins",
  "ingredients": [
    {
      "name": "Orgeat",
      "type": "category",
      "brix": 50,
      "quantity": {
        "amount": 0.5,
        "unit": "oz"
      }
    },
    {
      "name": "Lemon juice",
      "type": "juice",
      "quantity": {
        "amount": 1.5,
        "unit": "oz"
      }
    },
    {
      "name": "Orange juice",
      "type": "juice",
      "quantity": {
        "amount": 1.5,
        "unit": "oz"
      }
    },
    {
      "name": "Gin",
      "type": "category",
      "quantity": {
        "amount": 0.5,
        "unit": "oz"
      }
    },
    {
      "name": "Sherry (Oloroso)",
      "type": "category",
      "quantity": {
        "amount": 0.5,
        "unit": "oz"
      }
    },
    {
      "name": "Pisco",
      "type": "category",
      "quantity": {
        "amount": 1,
        "unit": "oz"
      }
    },
    {
      "name": "Blended lightly-aged rum",
      "type": "category",
      "quantity": {
        "amount": 2,
        "unit": "oz"
      }
    }
  ],
  "instructions": ["Float the sherry on top of the drink."],
  "attributions": [
    {
      "relation": "bar",
      "source": "Smuggler's Cove",
      "location": "San Francisco, CA"
    }
  ],
  "refs": [
    {
      "type": "book",
      "title": "smugglers-cove",
      "page": 275
    }
  ]
}
