{
  "$schema": "../../../../schemas/recipe.schema.json",
  "name": "Banshee",
  "preparation": "blended",
  "served_on": "blended",
  "glassware": "old fashioned",
  "ingredients": [
    {
      "name": "banana",
      "type": "fruit",
      "quantity": {
        "amount": 0.5,
        "unit": "unit"
      }
    },
    {
      "name": "Chocolate Bitters",
      "type": "category",
      "quantity": {
        "amount": 2,
        "unit": "dash"
      }
    },
    {
      "name": "Simple syrup",
      "type": "syrup",
      "quantity": {
        "amount": 0.75,
        "unit": "oz"
      }
    },
    {
      "name": "Lime juice",
      "type": "juice",
      "quantity": {
        "amount": 1,
        "unit": "oz"
      }
    },
    {
      "name": "Coconut milk",
      "type": "other",
      "quantity": {
        "amount": 1.5,
        "unit": "oz"
      }
    },
    {
      "name": "Jamaican Rum",
      "type": "category",
      "quantity": {
        "amount": 2.5,
        "unit": "oz"
      }
    }
  ],
  "refs": [
    {
      "type": "youtube",
      "videoId": "TnYC72GRkQQ",
      "channel": "make-and-drink"
    }
  ]
}
