{
  "$schema": "../../../../schemas/recipe.schema.json",
  "name": "Ultimate Mai Tai Navy Grog",
  "preparation": "shaken",
  "served_on": "ice cubes",
  "glassware": "old fashioned",
  "ingredients": [
    {
      "name": "Vanilla syrup",
      "type": "syrup",
      "quantity": {
        "amount": 0.5,
        "unit": "oz"
      }
    },
    {
      "name": "Lime juice",
      "type": "juice",
      "quantity": {
        "amount": 0.75,
        "unit": "oz"
      }
    },
    {
      "name": "Grapefruit juice",
      "type": "juice",
      "quantity": {
        "amount": 0.75,
        "unit": "oz"
      }
    },
    {
      "name": "Honey syrup",
      "type": "syrup",
      "quantity": {
        "amount": 1,
        "unit": "oz"
      }
    },
    {
      "name": "Hamilton Pimento Dram",
      "type": "liqueur",
      "quantity": {
        "amount": 0.5,
        "unit": "oz"
      }
    },
    {
      "name": "Ultimate Mai Tai Rum Blend",
      "type": "spirit",
      "quantity": {
        "amount": 1.5,
        "unit": "oz"
      }
    },
    {
      "name": "Lemon Hart 151",
      "type": "spirit",
      "quantity": {
        "amount": 1.5,
        "unit": "oz"
      }
    },
    {
      "name": "Seltzer",
      "type": "soda",
      "technique": {
        "technique": "application",
        "method": "top"
      },
      "quantity": {
        "amount": 2,
        "unit": "oz"
      }
    }
  ],
  "attributions": [
    {
      "relation": "recipe author",
      "source": "Kevin Crossman"
    }
  ],
  "refs": [
    {
      "type": "youtube",
      "videoId": "JniZAbdeBo8",
      "channel": "make-and-drink",
      "start": 165
    }
  ]
}
